id_post,post,siebert_label,siebert_score,bertweet_label,bertweet_score,cardiff_label,cardiff_score
52,"Gov Newsom embraces social media and I love it ❤️ | First off I’d like to say they regardless of your opinion on Gavin Newsom, California, your political party or ideology this 20 min interview on the Medius Network is worth your time if you are interested in American politics and the future of the Democratic parties campaign strategy. Like most I’ve been critical of the Democratic parties lack of engagement with social media, regular people and the demonization of the “the right” from many left wing pundits and media. Gavin Newsom is doing something the different and I’ll admit I’ve been sleeping on it until this video. Some highlights are: 1) Admitting the mistakes of the election, how “the left” is seen in the media. 2) Admitting the absolute dominance Trump and Republicans have in communicating information and sending the message of not just their own views but also that of Democrats with no Democrats in the space to fight back. 3) What California has been doing for the past three months since Trump was elected. Did you know it’s the world’s fifth largest economy and #1 manufacturing state in America? 4) Newsom has a podcast can he’s talked to Charlie Kirk on it. He’s also debated other right wing pundits and is a good debater. He also acknowledges with humility that he isn’t the one platforming them, they are platforming him. 5) To win the next election the Democratic Party needs its members to leave their Ivory Towers and go into the spaces where their critics live. To communicate the facts, what they are doing and why they are doing it. Not that they are just against Trump or think his supporters are bad.",POSITIVE,0.9988897442817688,POS,0.9269222021102905,positive,0.93727046251297
53,UC Davis protesters attack Turning Point USA tent,NEGATIVE,0.9993176460266113,NEG,0.8907960653305054,negative,0.6139702200889587
54,"Charlie Kirk makes money off of you publicly protesting/debating him | It all ends up chopped up and being put on his YouTube channel with titles like ""owning the libs"". I honestly feel like the best way to protest people like him are just simply ignoring their existence. If he ceases to generate content then he ceases to have a platform",NEGATIVE,0.9994964599609375,NEG,0.957319974899292,negative,0.869131326675415
55,Computing Giant Announces Historic Investment In  To Avoid Tariffs - Charlie Kirk,POSITIVE,0.9967491626739502,POS,0.816604495048523,neutral,0.8040721416473389
56,"How Turning Point USA Members Act Behind Closed Doors (from a former member) | Warning: Sensitive Content (transphobia, racism, islamaphobia, etc.) I DO NOT ENDORSE ANYTHING SAID IN THIS POST Howdy, fellow aggies. When I first came to Texas A&M, I was looking for orgs to join, and landed on TPUSA, as I found myself agreeing with most of their politics, and I wanted to see positive change in my community. I liked it at first, but overtime I became very disillusioned. I kept seeing more and more hateful rhetoric being spread, and it got to a point where I just stopped involving myself with the program altogether. I've been afraid to speak up on this issue (was worried about harassment), but with the upcoming Kirk visit, I feel as though it's my obligation to make sure that people are fully aware that this organization is largely run by people with malicious intentions, who never once cared about helping others. This is a sampling of some of said rhetoric found in their group chat. I can only post 20 pictures, but there are plenty more, to the point where I could make at least 2 follow-up posts for this semester alone.",NEGATIVE,0.9989669322967529,NEU,0.5948169231414795,negative,0.5460641384124756
57,"Charlie Kirk on Campus Today | Howdy ags! If you see Charlie Kirk on campus today or go to his talk, be sure to give him a warm greeting by isolating your middle finger and showing it to him (colloquially known as “flipping the bird”). This is a part of his culture and is a sign of respect 🥰🥰🥰 Edit: okay this is getting ridiculous. Obviously this is a shitpost (see tag) and no one is actually condoning this behavior. To all my liberal aggies considering engaging with Kirk today, stay calm and respectful. Expect him to talk loudly and quickly and claim it’s a win. Don’t let him get to you, stand by your beliefs.",POSITIVE,0.9864245057106018,NEU,0.7100914120674133,positive,0.8691496253013611
58,Charlie fucking Kirk is at my University and I am very upset about it :(,NEGATIVE,0.9994699358940125,NEG,0.976714015007019,negative,0.9522852897644043
59,[Real] Charlie Kirk won't debate Dean Withers,NEGATIVE,0.999414324760437,NEU,0.8992483019828796,neutral,0.8567985892295837
60,"Watch out for the guys at the Charlie Kirk table, one of them got violent | Basically just the header, a spokesperson at the table got really violent and tried to fight me. Just a PSA, I don't want anyone getting hurt. **(Edited to remove identifying information about any of the individuals mentioned per moderator  If you don't know already, Charlie Kirk is this alt-right, Christian nationalist grifter who comes to college campuses and farms content ""debating"" college students. He has these clubs across campus called ""Turning Point USA,"" who have been recently advertising his soon arrival at SFSU. While walking through the other tables after getting free pizza, I ran into a person who had been talking to the table for about 20 minutes. I leaned into him and said ""Charlie Kirk directly told a black child that the Civil Rights movement was a mistake on camera. If that isn't enough for these guys, I don't think arguing with them will do any good."" There were 3 people at that table. Lets call them **Person A**, **Person B**, and **Person C**. **Person A** said something along the lines of ""I don't agree with that, that's not good."" **Person B** disregarded the comment completely and continued the table's outreach. **Person C** started getting really heated and stanced up, violently threatening me. I was already about 20-30 feet away, and honestly I was more embarrassed for him than anything else at first. He kept flexing and yelling things like ""do you see a difference between you and me?"" I'm not the biggest guy physically, but I am **not identifiably taller or shorter** than him, so I responded ""about a foot."" I am not too proud of this encounter. I should not have made an emasculating comment based on his stature **or lack of stature**, but I think that sent him over the edge. I walked away into the library for some Peet's coffee, which was my plan this whole time, and he soon followed me into the library. I'm not sure what his plan was, to fight me in the library or what, but we ended up both getting in line for coffee. I kind of side-eyed him to see what he was up to, and he was already staring at me and just fuming. I asked, ""are you the guy who was trying to fight me outside?"" (He had taken off his sunglasses and he was holding his hat, so I wanted to be sure I had the right person). All that did was rile him up further, and he started saying stuff like, ""little b\*\*\*\* I would have decked you if I wanted to p\*\*\*\* a\*\* b\*\*\*\*"" right in front of the baristas. I felt super awkward and embarrassed, I felt awful for the baristas who were put into that situation of having to sit there while some insecure man started threatening me, but most of all, I felt really bad for the guy. He went off, ate at a table alone, and just kept staring at me until he left. I don't know if this guy is a student, an employee of TPUSA, or what, but definitely watch out for him. He's a bit unstable, and I don't want anyone to actually get hurt if he ends up making more than empty threats. I ended up telling campus security soon after it happened, and all they said they could do was ""keep an eye on him."" Edit: **Person C**, if you're reading this, don't just try to fight anyone who calls out racist comments. That's a really fast way to get expelled from SFSU, and I so desperately want you to get some form of education. Good luck out there! Edit II: The mods suggested that I fill out a title ix form, which I did. Edit III: Update in the comments",NEGATIVE,0.998392641544342,NEG,0.7020416259765625,negative,0.5565534830093384
61,"Is Charlie Kirk right about MLK? | > Who was MLK? A myth has been created and it has grown totally out of control While he was alive most people disliked him, yet today he is the most honored, worshipped, even deified person of the 20th century Today we are going to tell the truth and explain how this myth was born Happy Monday.  > Maybe once you break the mythical sainthood of someone like MLK, black voters will realize it’s being used against them to suppress the individual, and even more will realize they are on our side.  > “MLK was awful,” Kirk said. “He's not a good person. He said one good thing he actually didn't believe.” > “I have a very, very radical view on this, but I can defend it, and I’ve thought about it,” Kirk said at America Fest. “We made a huge mistake when we passed the Civil Rights Act in the 1960s.” > Kirk argues that the Civil Rights Act, which bars discrimination on the basis of race, ushered in a “permanent DEI-type bureaucracy,” referring to diversity, equity, and inclusion. > A spokesperson for TPUSA, Andrew Kolvet, said that Americans have been fed a “fake history.” “A core part of this fake history of America is the elevation of MLK into a saint, whose entire being is beyond reproach and above question,” Kolvet said in an emailed statement. “This sanctified version of MLK strips away his actual views and ignores his actual actions. The real MLK was a complicated person.”  > Kirk said that as soon as King became idolized, ""the progress of black America goes sideways."" ""Their cities disintegrate. Their families collapse. Educational progress stagnates. They become enormously dependent on government support,"" Kirk posted on X before adding that, ""You will know the tree by its fruit."" ""I haven't even done my show yet on MLK Jr. and already it's clear to me that I have found the sacred cow of modern America,"" Kirk posted on X on Monday morning. ""Ask yourself, why is exposing the flaws of MLK's life and character — something he said we should judge others by — so controversial? Has America become more colorblind, and merit based the more we have worshipped King?""  Do you agree or disagree with these statements and if so why? Both sides have been pretty pro-MLK for a long time so a big conservative leader standing against him is a big pivot. Is it justified or not?",POSITIVE,0.9918403625488281,NEU,0.7411390542984009,neutral,0.5949325561523438
62,"On Charlie  | Hey everyone. It seems confirmed he's coming in May. ME PERSONALLY, I think the best thing to do in this situation is to just ignore him. He thrives on the chaos and it's exactly what the student club invited him for. Nothing can prevent him from speaking unfortunately, but you can prevent him getting attention. These dudes have made their money and become famous off of stirring up controversy, so I personally feel the best way to fight it is to do the opposite. EDIT: The announcement was made on instagram: tpusa_inlandempire, tpusasouthwest, and tpusastudents. He'll be at the bell tower trying to start stuff. Please don't let him have access to you or your brain.",NEGATIVE,0.9984832406044006,NEG,0.6454431414604187,neutral,0.47756877541542053
63,"Charlie Kirk will be coming to UCSD’s Town Square tomorrow at 12pm | Tomorrow, May 1, 2025, the founder of TPUSA, Charlie Kirk, will be coming to UCSD to try to “debate” those who disagree with his views. The event was originally planned in front of Geisel but has since been moved to Town Square, near Yogurt World. This event WILL draw a sizable republican crowd to the area. All mic conversations with Kirk will be filmed by his crew. After he’s done, they’ll crop & edit the footage into 5-20 minute videos that will be uploaded on his YouTube channel and social media pages with clickbait titles like “Charlie Kirk takes on woke mob at University of California, San Diego” or “Brainwashed UCSD student gets destroyed in debate with Charlie Kirk.” This has been said many times but PLEASE do not try to debate him. Even if you try to debate him, you’ll be playing a rigged game. They control the cameras They control how the video is edited They control what gets posted They will find a way to remove you once you start winning the argument The only way we win is to starve them of content. No one engages, no one steps up, no one debates. They’ll have a sad booth with no opponents and they’ll leave.",NEGATIVE,0.9994818568229675,NEU,0.9075832962989807,neutral,0.9044985175132751
64,"To the guy who tried to debate Charlie Kirk and got absolutely obliterated | Bro why?? We spent TWO MONTHS telling everyone not to engage. And yet you still walked up there thinking you were gonna be different. You walked up to a professional rage baiter, a debater with years of practice, a dude who farms people like you for content, and thought you were gonna win? With what?? Reddit talking points? The second you said “uh… wait, can I check my phone?” and the whole crowd started laughing and booing. I felt so bad for you I literally felt my soul leave my body. I hope you’re doing okay but pls listen next time😭",NEGATIVE,0.9993041753768921,NEG,0.9238560199737549,negative,0.862327516078949
65,"Republican Party Rhetoric? | This growing race war and anti-black ideology within conservatism is pushing me further left than expected. At first, I disdained liberals and leftists for calling every Trump supporter racist because it devalues the word and rhetoric. I still don’t agree with this behavior whatsoever and loathe whoever does so. But, what is with more and more men being influenced under these hateful ideologies? You have Charlie Kirk preaching how systemic racism isn’t real and how we were better off before the Civil Rights Act. In addition to him making the assertion that Americans can’t trust Black employees due to DEI, despite white women being the biggest beneficiary which is disgusting. Then, Matt Walsh blew up for his claim on how Black men are disproportionately violent following the Karmelo Anthology stabbing. As a result, FBAs were offended and misled millions into believing it was in self defense. If anything this proved to me, regardless of race, the right has an unsettling rhetoric towards it and fueling division. Now you have young white men claiming how there’s a privilege to being Black because the family got a new car and house ( both of which were bought in 2023 so yet again disinformation .) This entire situation is messy because it had nothing to do with race but the right manipulated the narrative. Anyone who donated genuinely only believed it was out of this narrative he was jumped and bullied. Not solely because “ they wanted revenge on whites “. Finally, we have a woman receiving overwhelming support for calling an autistic child a n*gger as a rebuttal. Unfortunately, this radicalizes more Black Americans, as they witnessed white supremacists receive financial support repeatedly, yet now, when a young Black man is seemingly scrutinized for acting in self-defense, it’s considered wrong. It’s all just so gross to me- why can’t we acknowledge both class and race issues within America. Why can’t we all just listen to each other? I wanted to be a politician to genuinely help not only poor blacks but poor whites within the Appalachia region but if they’re gonna inherently think I’m violent is it even worth it? In all honesty, I want to still fight for the right, for actual conservatives, moderates and independents who felt forced into voting for Trump because Kamala was seen as worse. I want the Republican party to die off with this rhetoric for once. We have a center-right alternative guided by Thomas Massies or Rand Paul, and the Republican party can keep capitalizing off of culture wars. But then it is their responsibility to ensure men like Charlie Kirk, Kangmin Lee, Jack Posobiec and whoever else does not infiltrate and influence the party.",NEGATIVE,0.9982709884643555,NEG,0.9565600752830505,negative,0.7836905717849731
66,"All human lives are equal regardless of development argument. | Saw a video of Charlie Kirk debating someone on a college campus about abortion. According to him abortion is never morally permissible because all human lives, regardless of developmental stage or location, have rights and are entitled to life. But couldn’t this argument be countered with a thought experiment of a burning building where you can only save 5 human embryos or 1 toddler? Because if we were to follow Charlie Kirk’s argument, then the 5 human embryos would have to be saved since it’s better to save 5 lives over 1. However, most people in that scenario would probably go and save the 1 toddler, indicating developmental stage does play a role in personhood. Another counter could be triage at a hospital where a young adult and an elderly person come in with similar severe injuries, but more resources are directed to the young adult because it’s determined they have a better chance to live and recover than the elderly person.",NEGATIVE,0.9947150349617004,NEU,0.8931781649589539,neutral,0.5105398893356323
67,Charlie Kirk gets floored by college students on DEI!,NEGATIVE,0.9900312423706055,NEU,0.6237707734107971,neutral,0.5377793312072754
68,"Charlie Kirk coming to campus | Weird conservative grifter Charlie Kirk coming to campus to debate with college students. Don’t bother debating with him, he’s just gonna edit you out of his videos if you start winning. Just ignore him, don’t give him the content he wants. He makes money off of this. If you want to be really funny, bring a speaker and start playing copyrighted music nearby. That way any video he puts up will be copyright struck off YouTube and Insta reels. Deprive him the bag. 💰",NEGATIVE,0.9994660019874573,NEG,0.9470557570457458,negative,0.8222203850746155
69,"Surprise Privilege, False Flag, 9/11, and Stimulant throw punk show to disrupt cunt right winger Charlie Kirk's rally at SF State",NEGATIVE,0.9933110475540161,NEG,0.9529808163642883,negative,0.8723256587982178
70,(Real) HELP! is this hell???! Another Fox News host????!!,NEGATIVE,0.9993728995323181,NEG,0.9756196737289429,negative,0.9485529661178589
71,"A conversation between Gavin Newsom and Charlie Kirk | A good video that went viral a few months. If you’re the type of person who wants to see Kirk get “owned, bitched at or seriously challenged” just skip this. Gavin Newsoms goal during this wasn’t to wag his finger at Kirk. His goal was to learn the woke rights perspective, talking points, strategies and perspectives in order to use it against them and fight back against the aggressive right wing propagandists that won over young men and created such a strong following for Donald Trump. If you’re looking for a place to start in a long video I recommend around 22:30 when Newsom and Kirk talk about failed Democratic strategies in how they leave the battlefield uncontested to people like Kirk.",POSITIVE,0.9980044960975647,NEU,0.6920139193534851,neutral,0.6231768131256104
72,Charlie Kirk’s first debate against someone the age of 22 does not go well,NEGATIVE,0.9994730353355408,NEG,0.9612886905670166,negative,0.7340199947357178
73,Charlie Kirk schooled by Cambridge professor,NEGATIVE,0.9910250902175903,NEU,0.9510000944137573,neutral,0.8931602239608765
74,"Charlie Kirk attempts to debate at Cambridge, gets constantly destroyed by the youth.",NEGATIVE,0.9994828701019287,NEG,0.9596033692359924,negative,0.7886906266212463
75,"Thank you for fighting Charlie Kirk | Thank you. I am American (f) and I lived in the UK from 2020-2024. I just want to thank every single person who went to the Charlie Kirk debate recently and made him realize that his views, opinions and arguments do not reflect facts. I truly hope people who went to the debate see this and know it has reached the Americans who see him for the idiot he is and appreciate what you did. **EDIT:** In the hours since posting this, I didn’t expect it to receive so much attention, thank you to everyone who engaged with this in good faith. Your thoughtful comments and solidarity truly mean a lot. That said, I’ve also seen some hostility and dismissiveness, and I want to set the record straight. I’m in my late 20's and female. I earned two master’s degrees in the UK and worked for the NHS while living in the UK. I will not accept being belittled based on the passport I hold. You never know who’s on the other side of the screen, and bullying/rude comments says more about you than it does about me. Since returning to the  last year, I’ve watched my country, culture, and the values I was raised with fracture under growing political polarization. It’s been disorienting and painful. I’m aware that many people, including members of my extended family, support Charlie Kirk and buy into his rhetoric. That makes it all the more important for me to express my gratitude to those who challenge him. To the students and faculty who showed up and spoke at the debate: thank you. You stood firmly on facts and principle. You made it clear that his arguments do not reflect truth, and you reminded the rest of us that there *is* still space for reasoned, moral resistance.",POSITIVE,0.9974212646484375,POS,0.5481504201889038,positive,0.6760895848274231
76,Yes or No?,NEGATIVE,0.9074862599372864,NEU,0.9548254013061523,neutral,0.8409446477890015
77,"American conservative political activist Charlie Kirk publicly stating ""Give Donald Trump credit for successfully ending the India-Pakistan war"" during a debate session in Cambridge University, despite Trump himself stating earlier during a public rally that he""did not have too much of a hand in it""",POSITIVE,0.9941096305847168,NEU,0.7192481160163879,neutral,0.734937310218811
78,"Why did Charlie Kirk seem to not do well when debating college students at Cambridge University? | I’ve regrettably have seen many videos of Charlie Kirk’s debates with college students where he seems to appear to hold his own by using his debate tricks to make the other side look bad and ignorant. However, I’ve seen recent videos of him debating college students at Cambridge University, yet the college students seem to be able to handle his arguments and not be tripped up by his tricks. So why can Charlie Kirk easily win against American college students but not one Ms attending Cambridge University?",NEGATIVE,0.9985952973365784,NEG,0.8903568983078003,negative,0.5682072639465332
79,Rule,POSITIVE,0.9707406759262085,NEU,0.8870368599891663,neutral,0.644157886505127
