id_post,post,siebert_label,siebert_score,bertweet_label,bertweet_score,cardiff_label,cardiff_score
80,"How Trump just made Gavin Newsom’s day by sending the National Guard to Los Angeles — politically, anyway | On Monday, California Gov. Gavin Newsom announced that he would sue President Donald Trump’s administration for seizing control of the state’s National Guard to quell immigration enforcement protests in Los Angeles.   In response, Trump seconded his “border czar” Tom Homan’s threat that he might arrest the governor. “I would do it if I were Tom,” Trump told reporters. Just the day before, in an interview with NBC News, Newsom had all but dared Homan to arrest him.  The protests began late last week after Immigrations and Customs Enforcement agents conducted raids and arrests in Los Angeles at a Home Depot that resulted in 44 people being arrested.  The move gave Newsom, who has never been able to conceal his aspirations for higher office, an incredible surge of media attention just after he received months of public derision. In truth, Trump’s war on Los Angeles has given California’s Democrats, who have long been beleaguered, a new life. While California has long been one of the biggest vote banks for the Democrats, in recent years, it has caused just as much heartburn for the party. During the Covid-19 pandemic, people fled the state given the high cost of living, though it has seen its population grow in the past two years. California also accounted for a quarter of all homeless people in the United States in 2024, according to a report from the Department of Housing and Urban Development. Newsom has always had a penchant for the spectacle, going back to his time as mayor of San Francisco, when he performed same-sex marriages when even Democrats like Barack Obama and Hillary Clinton publicly opposed marriage for gay couples. He relished debating Ron DeSantis, Florida’s ultra-conservative governor, on Fox News and loves going on the network more than people might expect a Democrat from liberal San Francisco should. But he’s also faced criticism in recent months for how he handled — or failed to get a handle on — the out-of-control wildfires earlier this year. He’s also ruffled some Democratic feathers with his decision to chat with conservatives like former Trump adviser Steve Bannon and Turning Point USA founder Charlie Kirk on his podcast. When he spoke with Kirk, he said that allowing transgender athletes to compete in women’s sports was “deeply unfair,” which naturally angered progressives. But now, Newsom is in the place where he feels most comfortable, in a combative stance pushing back against the Trump administration. Like many other Democratic elected officials, he is weighing whether to jump into the 2028 presidential primary. If somehow Homan decides to slap some handcuffs, it would give Newsom potent fodder for voters in South Carolina and other early-voting primary states. The same can be said for Los Angeles Mayor Karen Bass. During the wildfires, Bass was actually not in Los Angeles, but rather in Ghana, which violated her campaign promise to Angelenos that she would not travel internationally while mayor. When a reporter grilled her about being absent during the worst fires in the city’s history, she stayed silent. Bass’ approval ratings plummeted in Los Angeles. And like many other cities with large Hispanic populations, Los Angeles shifted to the right in the 2024 election, though it remains firmly Democratic. This would put her in a difficult position going into Los Angeles’s election in 2026, which has a top-two primary system where the two highest-vote earners in the primary advance to the runoff regardless of party. But Bass, in part fueled by Trump’s federalizing the National Guard and sending them to her doorstep, has since pushed back to defend the city she leads. She has urged people to remain peaceful, saying: “We do not want to play into the [Trump] administration’s hands.” If Bass is seen as advocating for her city in a moment when its large immigrant population feels under siege, it could pay large dividends. Then, of course, there is Kamala Harris. In the months since Trump defeated the former vice president by winning the popular vote and all seven swing states, Harris has weighed whether to seek the governorship of the Golden State when Newsom’s term expires or to take another go at running for the presidency. Over the weekend, she denounced Trump’s escalation as “part of the Trump administration’s cruel, calculated agenda to spread panic and division.” Republicans have loved to beat up on California, a state they once dominated with luminaries such as Pete Wilson, Richard Nixon and Ronald Reagan. But if Trump and the GOP overstep their mandate, they risk a backlash and amplifying the very liberal politics and policies that they seek to quell, and might wind up making them stronger in the long run.",POSITIVE,0.9974760413169861,NEU,0.8779026865959167,neutral,0.7603293657302856
81,"Destiny urges us to learn from Charlie Kirk while he is failing to be Charlie Kirk | I agree with Destiny that the left should emulate Charlie Kirk. I just think he should set the example. To do so, yesterdays stream should have been 8 hours about: - The protests are actually  peaceful. - The violence is being overblown/manipulated by conservative media. - The **only** answer to the problems exposed by the peaceful protesters is electing democrats. - Trump is a fascist. Things a Kirk-esque commenter never would have spent a single breath on yesterday: - Far lefty’s are bad lol this looks bad maybe the other side is right we need to shape up guys we’re losing the optics war look at all the stuff the other side has against us now oh shucks oh darn.",NEGATIVE,0.9970093369483948,NEG,0.7382779121398926,neutral,0.6214457154273987
82,"Saving America | Biden let 21 Million Unvetted, Illegal Aliens flood into the Country from some of the most dangerous and dysfunctional Nations on Earth Many of them Rapists, Murderers, and Terrorists. This tsunami of Illegals has destroyed Americans' Public Schools, Hospitals, Parks, Community Resources, and Living Conditions. They have stolen American Jobs, consumed BILLIONS OF DOLLARS in Free Welfare, and turned once idyllic Communities, like Springfield, Ohio, into Third World Nightmares. I campaigned on, and received a Historic Mandate for, the largest Mass Deportation Program in American History. Polling shows overwhelming Public Support for getting the Illegals out, and that is exactly what we will do. As Commander-in-Chief, I will always protect and defend the Heroes of ICE and Border Patrol, whose work has already resulted in the Most Secure Border in American History. Anyone who assaults or attacks an ICE or Border Agent will do hard time in jail. Those who are here illegally should either self deport using the CBP Home App or, ICE will find you and remove you. Saving America is not negotiable!",POSITIVE,0.9943763017654419,NEG,0.9625105857849121,negative,0.6983875632286072
83,"Charlie Kirk, the mii you are",POSITIVE,0.9874669909477234,NEU,0.9008609056472778,negative,0.6973071694374084
84,“Toxic Empathy”🤣 they seriously think identifying with others is toxic.,NEGATIVE,0.9992320537567139,NEG,0.9760317206382751,negative,0.8048815131187439
85,"The oppressor / oppressed world view | This has become a talking point especially by right wing commentators describing progressives, the left, or academics, such as ""many adhere to a strict worldview where one group is the oppressor and one group is the oppressed."" This is one of Charlie Kirk's comments / criticisms and I've heard Bill Ackman use this language in reference to Harvard. Is this actually a view which is articulated / espoused / promoted / taught by these groups or is this just a somewhat pejorative framing of other ideas? Are there actually college courses titled ""the oppressor and the oppressed"" or some kind of Democrat policy documents that use this concept? I am sure that there are people that think this way and there are definitely people who are all about fighting ""The Man"" and (reasonably) talking about White Privilege. And a lot of the discourse around the Israel / Palestine situation is about which group is oppressing and which is oppressed and what each deserves as a result. But that doesn't make it some kind of unifying theory or driving idea across the entire progressive/left. I personally do not view the world in this way, I acknowledge that there is definitely a concentration of power among certain groups and a disenfranchisement of others. However, for example, I think that everyone should have access to health care whether they be working and able bodied, or retired, or disabled, or unemployed, not because some of these groups are oppressed but just because a wealthy government providing this to its citizens is a great way to provide them with better lives and allow them to recover from catastrophes and stay out of poverty. I also think that anyone of any persuasion should be able to get married and enjoy those benefits, not because they are oppressed but because they are humans and citizens and should be afforded the same benefits as everyone else regardless of their orientation. I think what is really happening is a desire to see complex issues as black and white (on the right) or nuanced (on the left). The right will distill every issue down to simple yes/no talking points, which creates an oversimplification but also creates very effective political messaging. For example, they say that all illegal immigrants are criminals and should be deported, regardless if their crime is overstaying a visa or murder. The left will endlessly debate the different categories of immigrants, where they came from, how long they have been in the US, their status, family situation, circumstances in their home country, etc. and try to come up with a tailored solution for each. I find both approaches impractical. I think the oppressor/oppressed framing is the right promoting a pejorative and oversimplified view of the Democratic ideal of equal rights for everyone including groups that may be disenfranchised. This leads to headlines like, ""The Disfiguring Prism of Oppressor and Oppressed"" and promotes the idea that Democrats / Progressives don't just have differing opinions, but have a deeply intrenched and fundamentally flawed philosophy of the world, which is just another way to widen the divide between the parties.",POSITIVE,0.9962980151176453,NEU,0.9064956307411194,negative,0.49801626801490784
86,"Charlie Kirk, what a dumbass",NEGATIVE,0.9994493126869202,NEG,0.9792002439498901,negative,0.91880863904953
87,"“Thin, fertile, and conservative”: Inside Turning Point USA’s conference for conservative young women",POSITIVE,0.9926778078079224,NEU,0.9422876238822937,neutral,0.7497639060020447
88,"2028 Democratic ranked choice primary poll | 2028 Dem Primary **READ ALL INFO BEFORE VOTING!!** Go to the poll linked and rank who you like and tell me why in the comments. Moore, Polis, Whitmer, and Fetterman have declined to run. Some possible new picks I will add later may or may not appear on the scene: Jon Ossoff, Raphael Warnock, and Chris Murphy. Don't ask me about Michelle Obama, Jon Stewart, Mark Cuban, or the Rock, they have no intentions of running. Link:  Info about the candidates: •Pete Buttigieg, mayor of Indiana and the secretary of transportation for the Biden administration. He ran in 2020 for the presidency running on a green new deal, universal healthcare, heavy anti trust regulations, free college for low income students, expanding farm worker rights, limiting campaign contributions, and a carbon tax. He is open to a presidential run in 2028. •Andy Beshear is the governor of Kentucky, former attorney general. Supports Medicaid expansion, supports death penalty(with exceptions for mentally ill) and clean coal technology, opposes union restrictions, supports legalizing all gambling, wants more infrastructure spending, opposes charter schools. Supports universal pre-k, banned conversion therapy, and strongly supports trans rights and has said lgbt kids are children of God. Has spent a lot on export subsidies. Responsible for highest GDP growth in Kentucky in over 30 years. Set an all time state record of $47.7 billion in exports in 2024. •Josh Shapiro is the governor of Pennsylvania, former attorney general. Supports charter schools and cutting corporate taxes, more infrastructure spending, supports universal preschool, business deregulation, wants to fund free school breakfasts, raising minimum wage, supports more funding to Israel, more money to private and religious schools, legalizing marijuana, supports stand your ground laws, criticized COVID-19 lockdowns, increased police funding. Suspected to have covered up a murder by one of his donors. •Ruben Gallego is the newly elected senator of Arizona and a Iraq war veteran, supports universal healthcare, against bank deregulation, wants higher corporate taxes, wants to ban offshore drilling, remove lead from drinking water, cut income taxes for the middle class, increase estate tax, against war with Yemen and Iran, wants to make all campaigns funded by public funds through voter vouchers, raising minimum wage, voted yes on a bill to restrict the anti Israel BDS movement •Gavin Newsom, governor of California, was the mayor of San Francisco. Supports subsidies to small businesses, against death penalty, wants tradable emissions permits, paid family leave, public financing for elections, universal healthcare, 2035 zero emissions requirements for cars and trucks, supports tax on gun sales and other higher taxes, passed unionized bargaining councils, is against a wealth tax. Receives extensive lobbying from corporate CEOs and has a dedicated hotline for them. Recently pivoted against trans sports. Has a podcast where he spoke to Charlie Kirk and Steven Bannon. Recently has been feuding with the trump administration over immigration and the national guard. •JB Pritzker, governor of Illinois, billionaire. Upgraded Illinois' bond rating by 9 letter grades. Built up the state's rainy day fund to 2.3 billion. Has ran a balanced budget 5 times in a row. Spent money from his own personal fortune for COVID-19 medical equipment when Trump blocked aid for the state and shared it with other states. Supports universal preschool, free community college, won't sign a bill by utility companies, wants to end citizens united, reduce property taxes, more infrastructure spending, more contracts with minority run businesses, adding public healthcare option, supports caps, mandates, and inspections on all emissions for facilities, against death penalty, wants to abolish cash bail, wants higher corporate taxes, progressive income tax, abolished grocery tax, signed 11 million in funding for local governments and private entities to open grocery stores and to boost already existing stores. Is against subsidies for building sports stadiums. Supports net neutrality. Cancelled one billion in medical debt. His family owns a foundation that has been donating to pro Palestine charities but when asked he dismisses the topic and refuses to answer any further. •Cory Booker, senator from New Jersey. Got into politics by going on a 10 day hunger strike to protest the lack of affordable housing in Newark. Supports cap and trade on emissions, a federal jobs guarantee, reparations, supports anti trust laws, free community college, banning fracking, a green new deal, raising minimum wage, against a wealth tax and wants a higher estate tax, against war in Yemen and Iran, supports a two state solution and funding for israel, voted yes on a bill to restrict the anti Israel BDS movement , lowering corporate tax and closing loopholes, regulate tech companies, increase loans to minority owned businesses, promote women owned businesses, as mayor of Newark he doubled affordable housing, reduced the Newark deficit by 60%, led the nation in reducing crime from 2006 to 2008, ran into a burning building and saved a woman's life, suffering burns on his hands in the process, after a hurricane, he allowed citizens without water and electricity to sleep and eat in his home, saved two dogs, helped a citizen propose to his girlfriend, recently achieved the longest senate speech in US history, surpassing segregationist Strom Thurmond's with a total time of 25 hours without food, water, or sleep and did not drink any water for 24 hours before starting his speech, took UFW on their offer to work for them picking produce as a farm worker for them, and did so much work that it was considered too much and would've taken away work from other workers •Ro Khanna, CA US house rep. Supports a green new deal, an internet bill of rights, free college both two year and four year, a financial transaction tax, universal healthcare, wants to ensure employees can elect one third of board members, refuses to take any PAC money and wants to have all elections funded by public vouchers, 10 dollar a day childcare, safety protections for sex workers, heavy anti trust regulations, end pharmaceutical monopolies by abolishing drug patents, against US intervention in Iran, Yemen, Israel, and Syria. Supports funding programs on college campuses to combat anti semitism and Holocaust denial, term limits for the supreme court, and is pro free speech, being against the twitter censorship of the leaked hunter Biden laptop story. Voted against impeaching Trump. •Dean Phillips, Minnesota house rep. Supports universal healthcare, paid family leave, fund renewable energy, regulate gas emissions, expand free trade, ban assault weapons, increase minimum wage, cut income taxes for middle class, against war with Iran. •Roy Cooper, governor of North Carolina. Supports universal Internet access, against tax cuts for wealthy and corporations, wants to pause immigration to North Carolina, expand Medicaid, supports concealed carry and taking guns from the mentally ill, limiting campaign contributions from corporations and PACs, supports regulating green house emissions, increasing teacher pay, legalizing medical marijuana only, supports increasing school funding, renewable energy. •AOC, New York house rep. Supports universal healthcare, higher taxes on the rich, a green new deal, higher minimum wage, worker cooperatives, a state owned public banking system, banning corporate donations, ceasefire in Palestine and Israel, said Israel is committing a genocide, repeal union restrictions, federal jobs guarantee, free public college, universal basic income, higher corporate taxes, expanding social security and Medicaid, abolishing ICE, cutting military budget. •Tim Walz, Minnesota governor, former US house rep, military veteran, and teacher. Supports a green new deal, Medicare for all, middle class tax cuts, Israel's right to defend itself, paid leave, capping credit card interest, free school lunch, and free contraceptives. Legalized marijuana. Signed a bill allocating $2.2 billion in additional funding for K-12 education, amounting to about $400 more per student annually than previous levels. •Stephen A Smith, sports host. Critical of Israel, supports lgbt rights, universal healthcare, and tax cuts. •Gina Raimondo, former governor of Rhode Island and former US secretary of commerce. Raised the minimum wage in her state to  repealed 30% of her state's regulations and cut taxes every year. Passed paid sick leave. Passed the states largest infrastructure project in history, made community college free. Increased the amount of black judges in government. Met with 101 wall street executives as secretary of commerce. Critical of AI. Increased programs for domestic chip manufacturing. •Rahm Emanuel, former mayor of Chicago and former white house chief of staff. Made Chicago a sanctuary city. Met with 26 lobbyists and deleted 90% of his emails. Cut funding for libraries and mental health clinics. Pro lgbt, pro choice, supported the iraq war and is pro israel. Closed 50 public schools and covered up a case of police brutality. •Jamie Raskin, US house rep. Wants to ban concentrated animal feeding operations, supports the green new deal, wants to abolish the death penalty, ban assault weapons, universal healthcare, ceasefire in Palestine and israel, raise the minimum wage, expand the supreme court, supports right to repair. Voted against impeaching Trump. •Amy Klobuchar, Minnesota senator. Supports a green new deal, opposes TPP, wants to end US involvement in the Yemen war, supported military involvement in Libya, voted to restrict Israel divestment, supports free community college, and antitrust laws.",POSITIVE,0.9922304749488831,NEU,0.9002147316932678,neutral,0.9079505801200867
89,"While trying to post a xenophobic “own”, Charlie Kirk accidentally stumbles into what is inspiring about America",POSITIVE,0.9792317152023315,NEG,0.49689650535583496,negative,0.7494262456893921
90,Presented without comment,POSITIVE,0.9652214050292969,NEU,0.9565185904502869,neutral,0.8381220102310181
91,Charlie Kirk's Ignorant Tweet Backfires.,NEGATIVE,0.9994812607765198,NEG,0.9759112596511841,negative,0.9023647904396057
92,Charlie calls out savage behavior from the presumptive new mayor of NYC,NEGATIVE,0.9994018077850342,NEG,0.830649197101593,negative,0.612790584564209
