id_post,post,siebert_label,siebert_score,bertweet_label,bertweet_score,cardiff_label,cardiff_score
93,"An FFRF staff member attended Charlie Kirk’s “Young Women’s Leadership Summit” — and it was a Christian nationalist cult of female submission | Walking into a Charlie Kirk–endorsed “Leadership Summit” geared toward young women, I already knew it would leave me upset. However, after a seemingly never-ending weekend, I realized it was not the constant degradation of women or the villainization of feminism that disturbed me the most, as I had expected. What bothered me more was the sheer number of young girls and women who surrounded me throughout the summit, cheering and rejoicing as Kirk and like-minded female acolytes delivered sermon-like remarks onstage that all zeroed in on one main idea: True femininity resides in servitude and motherhood. I attended Turning Point USA’s Young Women’s Leadership Summit in Grapevine, Texas, a suburb of Dallas, on June 13–15, alongside about 3,000 other attendees, mostly school-aged young women and girls. Predictably, the majority of attendees were white, although there was a notable presence of women of color. Just about every girl was dressed in some rendition of a brightly colored sundress or floral prairie dress, paired with cowboy boots and voluminous hair, a look popularized by an emerging wave of young women in the conservative base. Some wore MAGA merchandise, while others touted “Make America Healthy Again” (MAHA) tote bags. Arguably, Kirk and his political advocacy organization, Turning Point USA, have played a pivotal role in drawing young women to the ultraconservative right in droves, carving out a niche within the conservative base for a concentrated, traditional definition of femininity focused on marriage, motherhood and an RFK  understanding of health. It would be remiss not to mention the considerable presence that MAHA had at the event. Many speakers advertised their natural supplement lines or their toxin-free makeup and skincare brands. One speaker, a former trauma nurse, professed that the Western medical system is the “enemy of the world.” Prescription drugs were vilified, anti-vaccine rhetoric was celebrated, and science was belittled. The yearning for weight loss or fretting over processed foods are emerging as pipelines for young women to adopt ultraconservative worldviews. Podcasts covering the evils of seed oils and urging women to cook “real foods” are attracting susceptible girls to a new wave of conservatism: MAHA. One of the more popular speakers at the summit, podcaster Alex Clarke, quipped that we should “put women back in the kitchen” because the kitchen is where the “real revolution” starts. Before entering the convention hall, I passed tables encouraging attendees to start their own Turning Point chapters in their high schools or colleges. Next were packed booths selling trendy attire embroidered with “Save Women’s Sports” and posters featuring colorful illustrations of cowboy boots, along with catchy slogans like “Too Cute to Cancel,” alongside others offering anti-abortion propaganda, advertisements for health care sharing ministries and Christian education brochures. When the Young Women’s Leadership Summit kicked off, I quickly realized that, between the summit’s promotion of supplements to cure all health ailments and continuous God-blessings of Donald Trump, it was telling its receptive audience that not only are feminism and Western society lying to them about education, careers and self-sufficiency, but feminism is also concealing the foremost truth about femininity: Women need to be wives and mothers. There was what I can only describe as pure jubilance in the audience as Kirk called upon women to abandon careers and education to “submit to a godly man” and raise “more children than you can afford.” To Kirk, the ultimate goal for every girl should be marriage, and every single decision should push them closer to finding a husband. Without fail, any time a speaker mentioned being a mother or a wife, raucous applause and cheers erupted from the crowd. One speaker, Riley Gaines, best known for railing against transgender athletes, even publicly announced her pregnancy for the first time to a frenzied standing ovation, akin to the reaction of a crowd at a packed concert or sporting event. But Kirk’s messaging went well beyond glorifying marriage and motherhood — it resoundingly discouraged women from entering the workforce or pursuing education. At one point, Kirk professed that, “Husbands should do everything he can to not force his wife into the workforce.” But when he received an earnest question from a woman asking what federal policies he would back to make it possible for single-income households to survive financially, Kirk, predictably, did not have an answer. His solutions are not policy-based, but are instead rooted in indoctrination and unwavering obedience. In one of the two Q&A sessions Kirk led, as teenage girls lined up to ask for his wisdom on navigating school or balancing a career life with motherhood, Kirk stressed that women should not attend college and that high-school girls should prioritize marriage and children above all else. Kirk trumpeted that grades do not matter and that a true patriot should not care about them, suggesting that Christians get bad grades because they do not succumb to the “woke” teachings of the  education system and the Left. If girls do want to attend college, their end goal should not be a degree, but rather a husband, Kirk clarified. At one point, Kirk touted the idea that American society should “bring back” the “Mrs. Degree,” a concept dating back to the mid-19th century, in which women attended college with the intention of finding a husband. Kirk wants the reality for American women to be modeled after the 1950s — and a congregation of over 3,000 women and girls appeared to agree with him. Kirk further urged women not to listen to their professors. Texas state Sen. Angela Paxton claimed that the Left is poisoning kids’ minds through the education system. Speakers continually glorified homeschooling, especially when based in Christianity, and were met with rounds of applause. One speaker, author Heidi St. John, looked out at the crowd and praised: “I see a crowd of homeschool moms.” Countless more examples could be given of the summit demeaning the nation’s education system, and especially a woman’s role in it. (None of the speakers seemed to recognize the irony of Turning Point, the host organization, existing to establish chapters on college and high school campuses.) Speakers warned women and girls that a life filled with degrees and promotions would be empty and miserable. The summit depicted a pathetic and depressed image of the “modern Western woman,” one focused on a career, deprived of children. Feminists were described as hooked on dangerous antidepressants — their lives desolate. Kirk’s brand of traditional femininity and motherhood was juxtaposed as a way to achieve true fulfillment and happiness in an angry and divided society, leaving behind the mental health disorders born from the horrors of feminism. Followers believe the Young Women’s Leadership Summit’s brand of femininity to be the solution to the mental ailments young women face because of feminism, a sentiment I heard from attendees I spoke with. Vulnerable young girls, struggling with self-esteem, eating disorders, anxiety and depression, are turning to the Charlie Kirk world because it markets itself as a way to find happiness amid mental health discontent. Kirk’s wife, Erika Kirk, claimed to “release” girls from the anxieties of feminism, from the idea that they should chase a cozy corner office or a meaningless paycheck. She stressed that all the women in the crowd can, and ultimately should, rely on men, as relying on men is a path to happiness and contentment. For a woman, a career, financial independence or self-sufficiency is only a distraction. Of course, speakers differed in the severity of their messaging, with Kirk outright saying that women should not work, but instead serve their husbands and raise children, while others danced around the idea. All of the female speakers (with Kirk being the only male) had successful careers; there were even multiple female members of Congress who spoke: Reps. Nancy Mace and Beth Van Duyne. Some speakers argued that working could lead to marriage and children, while others said that a career only served as a hindrance to the true contentment that lies in motherhood. Some stressed that women can have both a career and children, just at different times, while others said that a life driven by a job and self-sufficiency would leave them wanting. Still, all of these women were the lead-up to Kirk’s argument that women should only be wives and mothers. Silent obedience, and especially the obedience characterizing the Virgin Mary, was also idolized during the summit, framed as something for every girl in attendance to strive for. Of course, that obedience pertains to following the whims of the men in their lives. Every time this happened, I looked around, horrified, at the children filling the rows and rows of chairs; girls as young as 5 attending with their mothers and grandmothers, young mothers rocking babies in their strollers, and high schoolers hanging on every word. Closing the first night with her husband next to her, Erika Kirk professed: “I get to serve my husband, I get to submit to my husband. He submits to the Lord.” Beyond the blatant dangers of telling young girls and women to obey men, seemingly without question, it was alarming to see just how glorified the idea of a subservient and silent woman was. It was straight out of Kirk’s rigid interpretation of the New Testament: “But I suffer not a woman to teach, nor to usurp authority over the man, but to be in silence,” from First Timothy 2:12. Even before attending, I saw that one of the summit’s advertisements depicted an embroidery hoop with its branding. It irked me to see Turning Point utilizing the beautiful art of embroidery, which was once demeaned to “women’s work” and cultivated as a means to teach obedience, domestic servitude and stillness, while also signaling marriage suitability, to promote its anti-feminist convention. It is safe to assume that the Young Women’s Leadership Summit did not use a reference to embroidery to convey any worthwhile message about women creating art and passion in times when women had few options, if any, in both the public and private spheres, or in an attempt to reclaim the art for genuine female empowerment. Instead, the summit wants to promote the image of an obedient, submissive wife and mother patiently waiting with her needlepoint for her husband to come home because that is, above all else, supposedly what women want. And still, with all the glorification of submission and servitude, I did not hear, during the entire three-day convention, a single mention of domestic abuse or the sexual violence that women and girls face, outside of hate-fueled rhetoric about transgender women and illegal immigrants. While Kirk and other speakers described the ideal woman as one subservient to her husband, there was not a single reference to the possible violence that concept invokes. To the teenage girls and the young women in their early 20s, neither Kirk nor any of the female speakers gave even a brief disclaimer on what to do when your husband, boyfriend or any man is physically or sexually violent. The closest reference was when Erika Kirk made one throwaway comment about how female submission is a “beautiful” thing only in a “healthy marriage.” Instead, Kirk went on an almost laughable tirade about how men are in a “far sicker” position in society than women because of things like “toxic masculinity” and men being talked down to. This is from the same man who argued with a female college student about rape statistics in May: “It is so materially insane to think that one in five American women will be raped in their life. … Meaning that they’re lying about being raped, that they’re lying about being sexually assaulted.” Kirk continued, saying, “Like a fraternity guy and a sorority girl, aged 19, hooking up, both five drinks in at 2  and all of a sudden she like removes consent. Yeah, like that’s a murky, middle gray area.” Any woman who is not indoctrinated into the Charlie Kirk world could tell you that the one in five statistic, if anything, is an underestimation. I would venture that even a sizable number of women and high-school-aged girls I shared a convention hall with would disagree with Kirk on this point. Perhaps that is why he did not philosophize about women lying about being victims of sexual violence during the summit. Instead, Kirk predictably stressed the importance of purity and modesty for young women and girls, but in a way that, once again, demeaned women. He framed the Christian value of waiting for sex until marriage as a way to improve the dating pool and to teach men “self-control,” placing the responsibility of teaching male “self-control” on young girls instead of boys. This is not a new concept in our society; it is something deeply ingrained into girlhood through adults dismissing destructive behavior as “boys will be boys” and questioning “What was she wearing?” This, coupled with Kirk’s lies about sexual violence and his desire for subservient women (women who do not “talk down to men,” or better yet, women who do not talk back), highlights the real danger created by giving men like Kirk a platform. Thousands of young women and girls looked on, starstruck, as Kirk espoused these dangerous, demeaning ideas. They cheered him on. They celebrated him. The Young Women’s Leadership Summit can perhaps be boiled down to Kirk’s most shocking quote of the weekend: “Young ladies need to be able to submit to a godly man.” He said that if the girls in the audience felt any internal disagreement with that, they should “just go pray about it.” Clearly, Kirk’s religious doctrine is how he explains and markets his ideas to young, impressionable girls. His warped understanding of Christianity is the basis for everything he stands for. Kirk and other speakers prepped attendees to engage in “spiritual warfare” (a favorite line of those subscribing to the New Apostolic Reformation that seeks complete dominion over society) for control of American culture, boasting that conservative women are going to save womanhood by integrating biblical values into society. This ultraconservative Christian base cannot be ignored. Turning Point USA promotes Christian nationalism and MAGA on high school and college campuses. It wields considerable influence, and it only grows with each passing year. This year marked the 10th anniversary of the Young Women’s Leadership Summit, and many speakers and attendees celebrated having attended ten years ago, now bringing their own children to the event. Speaker Alex Clarke boasted about the alumni-like network that the summit has formed, and here, she was right. Women and girls are recruited into this movement through family, friends, fellow students, podcasts and social media. They learn not to recoil when Kirk calls for a “return to normal,” referring to women “serving.” Even more so, they learn to celebrate female servitude as something to strive for — something that will heal and complete you. Young women and girls deserve better. I left this conference shocked at what I heard, even though I was familiar with Charlie Kirk and felt like I knew what to expect before attending. Going in, I already knew that nothing Charlie Kirk could say would have even the slimmest chance of changing my beliefs on where a “woman’s place” should be. The same cannot be said for the thousands of girls and women who also attended the Young Women’s Leadership Summit. Girls as young as 5 witnessed a weekend-long celebration of female servitude, while the women they look up to cheered it on. The Charlie Kirks of the world, and the women who follow them, cannot be written off as a fringe movement solely comprised of zealots. Turning Point USA has real, tangible power and is shaping the worldview of a new generation. The twisted religious doctrine that Charlie Kirk espouses cannot go unchallenged. Women and girls need to know that there is so much more in the world for them outside of submission. They need to be able to build lives based on their own values and aspirations, separate from those imposed by men masquerading as messiahs. We must be louder, clearer and more persistent than those telling susceptible women and girls that God ordains female submission under men.",NEGATIVE,0.9931219220161438,NEG,0.7624350786209106,negative,0.6398701071739197
94,A White House reporter from TPUSA (Charlie Kirk’s organization).,POSITIVE,0.983669638633728,NEU,0.9763292074203491,neutral,0.9274225234985352
95,Charlie Kirk,POSITIVE,0.987556517124176,NEU,0.9220278859138489,neutral,0.7837280631065369
96,Borat 2 (2020),NEGATIVE,0.9847474694252014,NEU,0.9604700207710266,neutral,0.8864520192146301
97,A new low for Charlie. 🤦‍♀️,NEGATIVE,0.997272789478302,NEG,0.980278730392456,negative,0.8879298567771912
98,Charlie needs better hygiene..,NEGATIVE,0.9988118410110474,NEG,0.7400451302528381,negative,0.6043268442153931
99,"Teenager allegedly stuffed plunger into man's mouth, doused him in bleach, kidnapped child",NEGATIVE,0.9978971481323242,NEG,0.9644779562950134,negative,0.7828298807144165
100,rule,POSITIVE,0.9766759276390076,NEU,0.8959062695503235,neutral,0.62708979845047
101,Homoerotic racism? I don’t even know anymore 💀,NEGATIVE,0.9140952229499817,NEG,0.9705425500869751,negative,0.9011591672897339
102,The new script is out everyone.,POSITIVE,0.9977707862854004,NEU,0.8131784796714783,neutral,0.7386022806167603
103,Charlie Kirk (alpha male) stands up to bullies and bars them from his special event.,POSITIVE,0.9940500855445862,POS,0.7784621715545654,neutral,0.635983943939209
104,The list of speakers at Charlie Kirk’s TPUSA event this weekend. 🤮🤮,POSITIVE,0.9986639022827148,NEU,0.979172945022583,negative,0.8885226249694824
105,"Charlie Kirk is coming to town next month | I heard from a friend that Charlie Kirk is coming to legacy Church on August 10. I was hoping to get some people together and we can protest him. Let's make sure it's and give Charlie Kirk a good old-fashioned Albuquerque welcome, please spread the word. I also posted this to threads, so if you wish to participate please share. I was hoping to post this to Albuquerque subreddit, but I'm banned from sharing there too.",NEGATIVE,0.993259072303772,NEU,0.7983136773109436,neutral,0.7363722324371338
106,"At the Turning Point USA conference, Tucker Carlsen challenges the Trump admin narrative about Jeffrey Epstein - and alleges that he was working for Israel’s Intelligence Agency.",NEGATIVE,0.9864780902862549,NEU,0.941045343875885,neutral,0.8694480061531067
107,It be more surprising if he weren't a hypocrite.,NEGATIVE,0.99898761510849,NEG,0.8334610462188721,negative,0.6022195219993591
108,What changed?,NEGATIVE,0.9831539988517761,NEU,0.8540340662002563,neutral,0.8394823670387268
109,U-Turn Point USA,NEGATIVE,0.9553669095039368,NEU,0.9598191380500793,neutral,0.8505577445030212
110,Charlie Kirk says ‘I’m done talking about Epstein’ after Trump call over weekend,NEGATIVE,0.9985191226005554,NEU,0.9367424249649048,neutral,0.6029653549194336
111,"Charlie Kirk backtracks after saying he’s ‘done talking about Epstein,’ claims he meant just ‘yesterday’",NEGATIVE,0.9977983236312866,NEU,0.6084739565849304,neutral,0.592682421207428
112,Charlie Kirk Reveals What He Thinks Is Behind Trump's Rationale Over the Epstein Files,NEGATIVE,0.8376243114471436,NEU,0.9756027460098267,neutral,0.7623319625854492
113,Charlie Kirk is a podcaster and he also dropped out of college,NEGATIVE,0.9993426203727722,NEG,0.5110682845115662,negative,0.8100284337997437
114,[Real] Charlie Kirk hosted a “focus group” with TPUSA student leaders where he encouraged allowing moderate criticism of Israel to prevent broader “Jew hate.”,NEGATIVE,0.9840251803398132,NEU,0.7687708139419556,neutral,0.8969911932945251
115,“People who live in glass houses shouldn't throw stones”,NEGATIVE,0.9954572916030884,NEG,0.6126063466072083,negative,0.5110512375831604
116,Charlie Kirk has terrible genes,NEGATIVE,0.9994387030601501,NEG,0.9772576689720154,negative,0.9056089520454407
117,The American Ignorance Tour,NEGATIVE,0.9925973415374756,NEG,0.7978141903877258,neutral,0.5666078925132751
118,"Turning Point USA Speaker Vince E. Ellison: “You walk into my world with a DEI stamp on your chest, and I’m gonna slit your throat!”",NEGATIVE,0.9923104047775269,NEG,0.9620727896690369,negative,0.7826883792877197
119,People on twitter are melting down because Charlie Kirk isn’t upset over the South Park parody of him🤨 | Almost all of these same people were screeching about Donald Trump not taking a joke just last week Are now screeching because Charlie Kirk can take a joke The argument changes whenever it’s convenient,NEGATIVE,0.9941383600234985,NEG,0.7673876285552979,negative,0.7308406233787537
120,"How Democratic streamers like Destiny are taking on MAGA and Charlie Kirk | A surprising CNN story discussing the impact of Charlie Kirk’s Turning Point America on Republican voters and how it was instrumental in cementing Republican voters into voting against Democrats rather than for Republicans. After being virtually unchallenged for a decade on social media and alternative spaces, streamers and influencers are now doing the same for the Democratic Party. Seeking to pop information bubbles, share why Democratic policy has been good for Americans and giving Democratic voters something to believe in and be proud of, that isn’t socialism or the radical left.",POSITIVE,0.9972136616706848,NEU,0.6854958534240723,neutral,0.698904275894165
121,MAGA pundit says Jasmine Crockett defending Black voters means she wants to end white race. Crockett called a proposed redistricting map racist since it would eliminate Black voting power. Charlie Kirk said that makes her the racist one.,NEGATIVE,0.9808778762817383,NEG,0.8069837093353271,negative,0.7404255867004395
122,An instant classic.,POSITIVE,0.9986091256141663,POS,0.7724048495292664,positive,0.8869544863700867
123,Charlie Kirk pins his reaction to the CNN video covering the Unfuck America Tour,NEGATIVE,0.9979416728019714,NEU,0.8937836289405823,neutral,0.8414228558540344
124,Charlie Kirk comments on Zee and the Unfuck America Tour interview on CNN,NEGATIVE,0.9917985200881958,NEU,0.893321692943573,neutral,0.822316586971283
