id_post,post,siebert_label,siebert_score,bertweet_label,bertweet_score,cardiff_label,cardiff_score
1,Remember: Your vote is 100% confidential. No one knows who you voted for except you!,POSITIVE,0.995966911315918,NEU,0.741308331489563,neutral,0.6582289934158325
2,Charlie Kirk falls for fake Garbage Driver Brent Terhune,NEGATIVE,0.9990261793136597,NEG,0.9351948499679565,negative,0.7426894307136536
3,Charlie Kirk - We need 3 million Trump voters to show up in Pennsylvania on Tuesday to win!,POSITIVE,0.9970199465751648,POS,0.60304856300354,neutral,0.6611654162406921
4,Reported by Charlie Kirk in PA,POSITIVE,0.9810040593147278,NEU,0.966320276260376,neutral,0.9400622844696045
5,Most watched streams during the Presidential Election,POSITIVE,0.9973107576370239,NEU,0.887336254119873,neutral,0.8690983057022095
6,"We really, really need to thank Charlie Kirk | Fwiw they have until Sunday to get ballots cured.",POSITIVE,0.997171938419342,POS,0.6561657786369324,positive,0.5279245376586914
7,Model Lucky Blue Smith reposts a Tiktok celebrating the Trump campaign winning their lawsuit in Bucks County. He also follows Charlie Kirk who headlined 4 Trump campaign events and is the founder of conservative youth organization Turning Point,POSITIVE,0.9976494908332825,NEU,0.5028759837150574,positive,0.6714561581611633
8,The great American reset - DOGE,POSITIVE,0.9978061318397522,POS,0.5636323094367981,neutral,0.4922429919242859
9,"Charlie Kirk warns Republican Senators to ""give Trump his cabinet,"" or he'll be activating his Turning Point operation even in their deep red states ""Your senators very well might end up being the issue of Trump not getting his cabinet. We might be coming to a city near you."" Cont: | Elon Musk has promised the same kind of involvement in primaries with America PAC. If Republicans don't immediately fall in line, we will LizCheney them in a far more embarrassing fashion.",NEGATIVE,0.9933778643608093,NEG,0.6262562274932861,neutral,0.5341262221336365
10,"What can democrats do to be more effective in today’s media environment? | One of the primary proposed causes of Harris’ loss this election was due to the current media environment. People have claimed that social media tends to favor conservative talking points and more effectively opens the door for conservative conspiracies. Republican talking points get proliferated with far more ease than Democrat ones. Reasons for this are various. Algorithms tend to favor more extreme rhetoric. Conservatives have a large influencer base like LibsofTikTok and Charlie Kirk. Joe Rogan was recently spiraled further and further right. Six of the top ten news podcasts are right wing, while there’s only one, maybe two, that could be considered left wing. Elon musk has purchased Twitter to make it a pro-conservative outlet. Traditional media institutions, including high have leaned left, like cable, newspapers, and local tv, have all been in sharp decline. Republicans have much more and modern media companies that are more deliberately conservative than democrats. What can democrats do to compete with the current modern media environment that heavily favors republicans? Do they need less purity tests? Do they need to reach out more to existing influencers and podcasters like Joe Rogan? Does the left need their own Joe Rogan? Do they need to push for more grass roots media companies? Do they need better messaging?",NEGATIVE,0.9952440857887268,NEU,0.8644046783447266,neutral,0.666695773601532
11,"What's up with people claiming Matt Gaetz is coming back to his seat in Congress in January? | **edit:** he will not be returning  >“I’m still going to be in the fight, but it’s going to be from a new perch. I do not intend to join the 119th Congress,” he told Charlie Kirk in an interview. Probably because that ethics report is really bad. ------- He definitely resigned from his seat. But I've seen people claim that he can come back in January because he won his election. Is that how it works? Example: here.",NEGATIVE,0.9991497993469238,NEG,0.812658429145813,neutral,0.49908798933029175
12,I'm honestly glad I'm off Twitter.,NEGATIVE,0.998648464679718,POS,0.8133296370506287,positive,0.6527195572853088
13,Mark: “is Charlie Kirk a white supremacist?” Cenk: “no” | The whole interview is Cenk shielding bullets for Charlie Kirk and MAGA,NEGATIVE,0.9978681802749634,NEG,0.8657488822937012,neutral,0.6243676543235779
14,Shooting fish in a barrel vs debating libertarians,NEGATIVE,0.9994338154792786,NEU,0.6740031242370605,neutral,0.7759619951248169
15,"I’m a conservative Canadian but I’m also pro choice… | I’m kind of in a rock and a hard place on my stance on abortions because Pierre Poilievre is super pro choice anyways so that’s obvious  an election is called in  already know who I’m voting for. However, it kind of got me thinking because abortion is such a focal conversation in  politics because the right in the  always has massive DISTASTE for abortions that the right in Canada never really emphasises on. I mean if I just take a look at the three most recent Conservative prime ministers that Canada has had, we have Stephen Harper, Kim Campbell, and Brian Mulroney. ####Stephen Harper: Was pro life but had no interest in making abortion illegal. ####Kim Campbell: Was 100% pro choice. ####Brian Mulroney: Same situation as Stephen Harper…. It kind of got me thinking because I am a little bit of a right wing wing nut and tend to agree with a lot of what people like Ben Shapiro and Charlie Kirk……SAY ABOUT  I don’t think abortions should be illegal in Canada mainly because there are instances where women HAVE TO HAVE ABORTIONS. Now sometimes it was the aftermath of irresponsibility but that doesn’t matter when the mother’s life is genuinely at risk. Of course I believe that abortions should be allowed if there are SEVERE fetal abnormalities but I don’t look at that as being all that different from miscarriages so I almost feel like those don’t COUNT. I don’t even care about incest……so what if the baby is born with autism?! I have autism and I’m glad MY MOM DIDN’T ABORT ME! The only two valid reasons (and I think most of this subreddit will agree) that one should abort a fetus is if it was conceived through rape or if the mother’s life is  AT RISK BECAUSE SHE’S PREGNANT which is literally a 1 in 100,000 type thing and literally happens in Canada like 8-9 times per decade. I personally think women that are raped should always keep their baby’s if the mother is almost definitely going to live as it isn’t fair to give a baby the death penalty based off of someone else’s actions. I did come up with a law this afternoon that I think if passed in Canada (The  could obviously do something similar) could potentially solve this problem and make abortions much more moral when they happen by simply making them as rare as absolutely possible. I was  order to limit clothing hanger/back alley abortions even though they would be inevitable in Canada if they weren’t always safe and legal and considered “healthcare” (what a joke lol)……Canada could maybe introduce a National Abortion Day so let’s say hypothetically that day is “September 28th” and three weeks leading up to this  pregnant woman that wants to have an abortion can register in one of the 10 provinces in Canada with  having abortions be illegal and then also making abortions illegal in all three  what would happen is LITERAL COPS……would interrogate the pregnant woman asking why she wants to have an abortion and below are the amount of abortions that will be ACCEPTED on Abortion Day in Canada in every province excluding   is really tiny hence why I think abortions should be illegal there): Ontario: 20 Quebec: 11 British Columbia: 7 Alberta: 6 Manitoba: 2 Saskatchewan: 2 Nova Scotia: 1 New Brunswick: 1 Newfoundland and Labrador: 1 Total annual authorised abortions nationwide 🇨🇦: 51 I personally don’t care about women’s feelings when it comes to the topic of abortions when the baby was conceived through incest or INCONVENIENCE  a teenaged pregnancy which MIGHT BE the main cause for abortions in Canada) but I understand that some men care (I’m a man) and definitely a lot of women care. I do however have a lot of sympathy for rape victims that get pregnant as well as me OBVIOUSLY having sympathy for girls, teenagers, or women who will probably DIE if they don’t abort their babies even though that latter situation is extremely rare. However, I personally think that if hypothetically the mother is going to LIVE if she gives birth but the baby was conceived through rape, she should 100% keep it. It would be emotionally and physically painful but I still recommend it. I think the main fallacy in having a “National Abortion Day” in Canada is that……what if a girl, teenager, or woman gets pregnant just  DAYS after National Abortion Day and her life is genuinely at risk if she doesn’t abort the baby……then in those situations obviously I’d prefer for the baby to be aborted OBVIOUSLY……so maybe having 2-4 “Abortions Days” a year rather than just one where like 13-26 abortions are authorised per Abortion Day might be a better law. The big issue with abortions that many conservatives have is trusting  society is set up now where women can just go and have abortions because the fetus has Down Syndrome and there’s even been cases where women have had abortions because they wanted the other gender instead. It’s truly disgusting and BECAUSE OF  when getting interrogated by the cops as to why they want to have  JUST LIE. Now God says for human beings to never lie but Canada really has lost religion so that doesn’t matter and  abortions are happening nationwide in Canada annually when really, it should be closer to 50-60……it’s absolutely disgusting that so many women are MURDERING THEIR  they are inconvenient when they could just give them up for adoption. I mean Mother Teresa was a hero for saving so many children from getting aborted by really pushing for adoption rather than abortion. Being pregnant is exceptionally difficult for all women but if the mother is going to  DON’T. CARE. I’m more empathetic of babies getting murdered that would’ve had 81 years to live than mothers who have to deal with the pain of being pregnant. What do y’all think of everything I’ve said?",POSITIVE,0.991431713104248,NEU,0.8726739287376404,neutral,0.737926721572876
16,"I’m a Canadian conservative but I’m also pro choice…. | I’m kind of in a rock and a hard place on my stance on abortions because Pierre Poilievre is super pro choice anyways so that’s obvious  an election is called in  already know who I’m voting for. However, it kind of got me thinking because abortion is such a focal conversation in  politics because the right in the  always has massive DISTASTE for abortions that the right in Canada never really emphasises on. I mean if I just take a look at the three most recent Conservative prime ministers that Canada has had, we have Stephen Harper, Kim Campbell, and Brian Mulroney. ####Stephen Harper: Was pro life but had no interest in making abortion illegal. ####Kim Campbell: Was 100% pro choice. ####Brian Mulroney: Same situation as Stephen Harper…. It kind of got me thinking because I am a little bit of a right wing wing nut and tend to agree with a lot of what people like Ben Shapiro and Charlie Kirk……SAY ABOUT  I don’t think abortions should be illegal in Canada mainly because there are instances where women HAVE TO HAVE ABORTIONS. Now sometimes it was the aftermath of irresponsibility but that doesn’t matter when the mother’s life is genuinely at risk. Of course I believe that abortions should be allowed if there are SEVERE fetal abnormalities but I don’t look at that as being all that different from miscarriages so I almost feel like those don’t COUNT. I don’t even care about incest……so what if the baby is born with autism?! I have autism and I’m glad MY MOM DIDN’T ABORT ME! The only two valid reasons (and I think most of this subreddit will agree) that one should abort a fetus is if it was conceived through rape or if the mother’s life is  AT RISK BECAUSE SHE’S PREGNANT which is literally a 1 in 100,000 type thing and literally happens in Canada like 8-9 times per decade. I personally think women that are raped should always keep their baby’s if the mother is almost definitely going to live as it isn’t fair to give a baby the death penalty based off of someone else’s actions. I did come up with a law this afternoon that I think if passed in Canada (The  could obviously do something similar) could potentially solve this problem and make abortions much more moral when they happen by simply making them as rare as absolutely possible. I was  order to limit clothing hanger/back alley abortions even though they would be inevitable in Canada if they weren’t always safe and legal and considered “healthcare” (what a joke lol)……Canada could maybe introduce a National Abortion Day so let’s say hypothetically that day is “September 28th” and three weeks leading up to this  pregnant woman that wants to have an abortion can register in one of the 10 provinces in Canada with  having abortions be illegal and then also making abortions illegal in all three  what would happen is LITERAL COPS……would interrogate the pregnant woman asking why she wants to have an abortion and below are the amount of abortions that will be ACCEPTED on Abortion Day in Canada in every province excluding   is really tiny hence why I think abortions should be illegal there): Ontario: 20 Quebec: 11 British Columbia: 7 Alberta: 6 Manitoba: 2 Saskatchewan: 2 Nova Scotia: 1 New Brunswick: 1 Newfoundland and Labrador: 1 Total annual authorised abortions nationwide 🇨🇦: 51 I personally don’t care about women’s feelings when it comes to the topic of abortions when the baby was conceived through incest or INCONVENIENCE  a teenaged pregnancy which MIGHT BE the main cause for abortions in Canada) but I understand that some men care (I’m a man) and definitely a lot of women care. I do however have a lot of sympathy for rape victims that get pregnant as well as me OBVIOUSLY having sympathy for girls, teenagers, or women who will probably DIE if they don’t abort their babies even though that latter situation is extremely rare. However, I personally think that if hypothetically the mother is going to LIVE if she gives birth but the baby was conceived through rape, she should 100% keep it. It would be emotionally and physically painful but I still recommend it. I think the main fallacy in having a “National Abortion Day” in Canada is that……what if a girl, teenager, or woman gets pregnant just  DAYS after National Abortion Day and her life is genuinely at risk if she doesn’t abort the baby……then in those situations obviously I’d prefer for the baby to be aborted OBVIOUSLY……so maybe having 2-4 “Abortions Days” a year rather than just one where like 13-26 abortions are authorised per Abortion Day might be a better law. The big issue with abortions that many conservatives have is trusting  society is set up now where women can just go and have abortions because the fetus has Down Syndrome and there’s even been cases where women have had abortions because they wanted the other gender instead. It’s truly disgusting and BECAUSE OF  when getting interrogated by the cops as to why they want to have  JUST LIE. Now God says for human beings to never lie but Canada really has lost religion so that doesn’t matter and  abortions are happening nationwide in Canada annually when really, it should be closer to 50-60……it’s absolutely disgusting that so many women are MURDERING THEIR  they are inconvenient when they could just give them up for adoption. I mean Mother Teresa was a hero for saving so many children from getting aborted by really pushing for adoption rather than abortion. Being pregnant is exceptionally difficult for all women but if the mother is going to  DON’T. CARE. I’m more empathetic of babies getting murdered that would’ve had 81 years to live than mothers who have to deal with the pain of being pregnant. What do y’all think of everything I’ve said?",POSITIVE,0.9915809035301208,NEU,0.8718336224555969,neutral,0.7383019328117371
17,Charlie Kirk posting on Twitter rn,POSITIVE,0.9889285564422607,NEU,0.9683389663696289,neutral,0.8876430988311768
18,Charlie Kirk's kneepads must be getting worn out,NEGATIVE,0.9982571005821228,NEG,0.8979302644729614,negative,0.7528519630432129
19,Censorship in instagram | Instagram is censoring searches related to democrats,NEGATIVE,0.9993069171905518,NEG,0.9129894971847534,negative,0.7382246851921082
20,Just 2 alpha males showing off their intelligence,NEGATIVE,0.991703987121582,NEU,0.7388924956321716,positive,0.7008501291275024
21,Only advice I'd take from Charlie Kirk is about today's specials.,NEGATIVE,0.9963053464889526,NEU,0.7626745700836182,neutral,0.7560548782348633
22,"And Israel, Charlie.",POSITIVE,0.9963746666908264,NEU,0.9419147372245789,neutral,0.6414759755134583
23,"Large influx of 3%s and patriot front members showing up at a private gun range near me | I have a friend that goes to a near by shooting range, this range provides many different courses and i use to just think that this group just fleeced its members to generate money with ridiculous training but it seems like they are no longer advertising their training or services online . He noted that there were several vehicles in the parking lot that had III (3% ) and some with the patriot front fasces. With all the talk of a "" civilian army"" being used against civilians and the uptick in these extremist training its not terribly hard to draw connecting lines to the dots. You guys remember that r/law post about creating a army? EDIT: Original post:  Original article without paywall:  The primary source is from an interview Stephen Miller did at Charlie Kirk's podcast:  Washington Post article:  _______________________________________ ERIC PRINCE pushing for private citizen army:  DONALD TRUMP says he knows nothing about project 2025 during campaign. Then brings on Russel Vought Whitehouse staff  _______________________________________ Literal Nazis showed up at a Greensboro-based reporter's home in the Gate City.  ""Around 5  on Feb. 10, six Nazis approached my house on a quiet, residential street in Greensboro,  They held burning traffic flares as they raised their arms in Nazi salutes. _____________________________________________________ Patriot front banner draped over bridge in winston Salem.  MAP OF HATE GROUPS FLYERING IN THE US  EDIT: THANKS TO U/BladedNinja23198 FOR THE LINKS",NEGATIVE,0.9944091439247131,NEU,0.5672463774681091,neutral,0.6115400791168213
24,Charlie Kirk blames the deaths caused by the Russian invasion on Zelensky,NEGATIVE,0.9910683631896973,NEG,0.9172238111495972,negative,0.7422419786453247
25,Charlie Kirk vs. Woke Elon Musk Hater on DOGE,NEGATIVE,0.9915581941604614,NEU,0.8523998856544495,neutral,0.5699286460876465
